{
  "meta": {
    "skill_id": "test_skill-0.1.0-3dd621c7",
    "skill_name": "test_skill",
    "generated_at": "2026-03-15T15:35:15.899880+00:00",
    "t6_version": "1.0.0-t6",
    "run_id": "20260315_153515"
  },
  "input_sources": {
    "validation_report": "run\\T7_regression\\test_missing_manifest\\validation_report.json",
    "rule_scan_report": "run\\T7_regression\\test_missing_manifest\\rule_scan_report.json",
    "pattern_detection_report": "run\\T7_regression\\test_missing_manifest\\pattern_detection_report.json"
  },
  "findings": [],
  "summary": {
    "total_findings": 0,
    "by_severity": {
      "CRITICAL": 0,
      "HIGH": 0,
      "MEDIUM": 0,
      "LOW": 0,
      "INFO": 0
    },
    "by_category": {},
    "by_source": {
      "validation": 0,
      "rule_scan": 0,
      "pattern_match": 0
    },
    "by_confidence": {
      "very_high (0.95-1.0)": 0,
      "high (0.85-0.95)": 0,
      "medium (0.70-0.85)": 0,
      "low (<0.70)": 0
    }
  }
}