{
  "meta": {
    "skill_id": "test_skill-1.0.0-abc123",
    "skill_name": "test_skill",
    "generated_at": "2026-03-16T12:00:00Z",
    "t6_version": "1.0.0-t6",
    "run_id": "test_run"
  },
  "input_sources": {
    "validation_report": null,
    "rule_scan_report": null,
    "pattern_detection_report": null
  },
  "findings": [
    {
      "finding_id": "F-rule_scan-E401-12345678",
      "source": {
        "type": "rule_scan",
        "code": "E401_DANGEROUS_EVAL"
      },
      "what": {
        "title": "Dangerous Eval Usage",
        "description": "Found eval() usage",
        "category": "dangerous_pattern",
        "severity": "LOW",
        "confidence": 0.9
      },
      "where": {
        "file_path": "skill.py",
        "line_number": 42
      },
      "evidence_refs": [
        {
          "kind": "FILE",
          "locator": "run/test/rule_scan_report.json"
        },
        {
          "kind": "CODE_LOCATION",
          "locator": "skill.py:42"
        }
      ],
      "detected_at": "2026-03-16T12:00:00Z"
    }
  ],
  "summary": {
    "total_findings": 1,
    "by_severity": {
      "CRITICAL": 0,
      "HIGH": 0,
      "MEDIUM": 0,
      "LOW": 1,
      "INFO": 0
    },
    "by_category": {
      "dangerous_pattern": 1
    },
    "by_source": {
      "validation": 0,
      "rule_scan": 1,
      "pattern_match": 0
    },
    "by_confidence": {
      "very_high (0.95-1.0)": 0,
      "high (0.85-0.95)": 1,
      "medium (0.70-0.85)": 0,
      "low (<0.70)": 0
    }
  }
}